{
  "schemaVersion": "1.0.0",
  "caseId": "case-2598074512",
  "displayName": "Default fixed-geometry case",
  "parameters": {
    "A0": 0.105,
    "h0": 0.3,
    "h1": 0.04,
    "h3": 0.12,
    "h5": 0.065,
    "Y2": 0.015,
    "Y4": 0.035,
    "W1": 0.06,
    "W2": 0.03,
    "L1": 0.3,
    "L2": 0.18,
    "L3": 0.245,
    "L4": 0.325,
    "A": 0.0002,
    "W": 0.3,
    "alpha": 0.02,
    "Ct": 0.004,
    "ht": 0.003,
    "P24t": 0.015,
    "hw": 0.02,
    "h_a": 0.01,
    "bendR": 0.024
  },
  "derived": {
    "r": 0.007978845608,
    "P4t": 0.02,
    "h2": 0.285,
    "h4": 0.335,
    "X2": 0.173132896932,
    "X3": 0.245070369781,
    "X4": 0.362543771026,
    "X5": 0.543444296177,
    "S0": -0.176867103068,
    "S1": 0.06,
    "S2": 0.513444296177,
    "C1": 0.124905874392,
    "C2": 0.109775989419,
    "H0": 0.228,
    "planArea": 0.105,
    "points": {
      "W0": {
        "x": -0.176867103068,
        "y": 0.3
      },
      "P1": {
        "x": 0.0,
        "y": 0.04
      },
      "W1": {
        "x": 0.06,
        "y": 0.124905874392
      },
      "P2": {
        "x": 0.173132896932,
        "y": 0.285
      },
      "P3": {
        "x": 0.245070369781,
        "y": 0.12
      },
      "P4": {
        "x": 0.362543771026,
        "y": 0.335
      },
      "W2": {
        "x": 0.513444296177,
        "y": 0.109775989419
      },
      "P5": {
        "x": 0.543444296177,
        "y": 0.065
      }
    },
    "tubePolyline": [
      {
        "x": 0.0,
        "y": 0.04
      },
      {
        "x": 0.159282265177,
        "y": 0.2654
      },
      {
        "x": 0.160599153434,
        "y": 0.268622222222
      },
      {
        "x": 0.161886465519,
        "y": 0.271555555556
      },
      {
        "x": 0.163144201432,
        "y": 0.2742
      },
      {
        "x": 0.164372361174,
        "y": 0.276555555556
      },
      {
        "x": 0.165570944745,
        "y": 0.278622222222
      },
      {
        "x": 0.166739952143,
        "y": 0.2804
      },
      {
        "x": 0.16787938337,
        "y": 0.281888888889
      },
      {
        "x": 0.168989238426,
        "y": 0.283088888889
      },
      {
        "x": 0.17006951731,
        "y": 0.284
      },
      {
        "x": 0.171120220022,
        "y": 0.284622222222
      },
      {
        "x": 0.172141346563,
        "y": 0.284955555556
      },
      {
        "x": 0.173132896932,
        "y": 0.285
      },
      {
        "x": 0.17409487113,
        "y": 0.284755555556
      },
      {
        "x": 0.175027269156,
        "y": 0.284222222222
      },
      {
        "x": 0.17593009101,
        "y": 0.2834
      },
      {
        "x": 0.176803336693,
        "y": 0.282288888889
      },
      {
        "x": 0.177647006204,
        "y": 0.280888888889
      },
      {
        "x": 0.178461099544,
        "y": 0.2792
      },
      {
        "x": 0.179245616712,
        "y": 0.277222222222
      },
      {
        "x": 0.180000557708,
        "y": 0.274955555556
      },
      {
        "x": 0.180725922533,
        "y": 0.2724
      },
      {
        "x": 0.181421711187,
        "y": 0.269555555556
      },
      {
        "x": 0.182087923668,
        "y": 0.266422222222
      },
      {
        "x": 0.182724559979,
        "y": 0.263
      },
      {
        "x": 0.235478706734,
        "y": 0.142
      },
      {
        "x": 0.236204833899,
        "y": 0.13852196712
      },
      {
        "x": 0.23694426617,
        "y": 0.135342970522
      },
      {
        "x": 0.237697003548,
        "y": 0.132463010204
      },
      {
        "x": 0.238463046034,
        "y": 0.129882086168
      },
      {
        "x": 0.239242393627,
        "y": 0.127600198413
      },
      {
        "x": 0.240035046327,
        "y": 0.125617346939
      },
      {
        "x": 0.240841004135,
        "y": 0.123933531746
      },
      {
        "x": 0.24166026705,
        "y": 0.122548752834
      },
      {
        "x": 0.242492835072,
        "y": 0.121463010204
      },
      {
        "x": 0.243338708201,
        "y": 0.120676303855
      },
      {
        "x": 0.244197886437,
        "y": 0.120188633787
      },
      {
        "x": 0.245070369781,
        "y": 0.12
      },
      {
        "x": 0.245956158232,
        "y": 0.120110402494
      },
      {
        "x": 0.24685525179,
        "y": 0.12051984127
      },
      {
        "x": 0.247767650456,
        "y": 0.121228316327
      },
      {
        "x": 0.248693354228,
        "y": 0.122235827664
      },
      {
        "x": 0.249632363108,
        "y": 0.123542375283
      },
      {
        "x": 0.250584677095,
        "y": 0.125147959184
      },
      {
        "x": 0.25155029619,
        "y": 0.127052579365
      },
      {
        "x": 0.252529220391,
        "y": 0.129256235828
      },
      {
        "x": 0.2535214497,
        "y": 0.131758928571
      },
      {
        "x": 0.254526984116,
        "y": 0.134560657596
      },
      {
        "x": 0.25554582364,
        "y": 0.137661422902
      },
      {
        "x": 0.25657796827,
        "y": 0.14106122449
      },
      {
        "x": 0.351036172537,
        "y": 0.31393877551
      },
      {
        "x": 0.351924433158,
        "y": 0.317259837781
      },
      {
        "x": 0.352825549401,
        "y": 0.32029618001
      },
      {
        "x": 0.353739521266,
        "y": 0.323047802198
      },
      {
        "x": 0.354666348753,
        "y": 0.325514704343
      },
      {
        "x": 0.355606031861,
        "y": 0.327696886447
      },
      {
        "x": 0.356558570591,
        "y": 0.329594348509
      },
      {
        "x": 0.357523964943,
        "y": 0.331207090529
      },
      {
        "x": 0.358502214916,
        "y": 0.332535112507
      },
      {
        "x": 0.359493320511,
        "y": 0.333578414443
      },
      {
        "x": 0.360497281728,
        "y": 0.334336996337
      },
      {
        "x": 0.361514098566,
        "y": 0.334810858189
      },
      {
        "x": 0.362543771026,
        "y": 0.335
      },
      {
        "x": 0.363586299108,
        "y": 0.334904421769
      },
      {
        "x": 0.364641682811,
        "y": 0.334524123496
      },
      {
        "x": 0.365709922136,
        "y": 0.333859105181
      },
      {
        "x": 0.366791017083,
        "y": 0.332909366824
      },
      {
        "x": 0.367884967651,
        "y": 0.331674908425
      },
      {
        "x": 0.368991773841,
        "y": 0.330155729984
      },
      {
        "x": 0.370111435653,
        "y": 0.328351831502
      },
      {
        "x": 0.371243953087,
        "y": 0.326263212977
      },
      {
        "x": 0.372389326142,
        "y": 0.323889874411
      },
      {
        "x": 0.373547554819,
        "y": 0.321231815803
      },
      {
        "x": 0.374718639117,
        "y": 0.318289037153
      },
      {
        "x": 0.375902579037,
        "y": 0.315061538462
      },
      {
        "x": 0.543444296177,
        "y": 0.065
      }
    ],
    "holderBases": [
      {
        "name": "W1",
        "x": 0.06,
        "y": 0.0
      },
      {
        "name": "P3",
        "x": 0.245070369781,
        "y": 0.0
      },
      {
        "name": "W2",
        "x": 0.513444296177,
        "y": 0.0
      },
      {
        "name": "P4",
        "x": 0.362543771026,
        "y": 0.3
      }
    ],
    "structure": {
      "containerLeft": -0.176867103068,
      "containerRight": 0.173132896932,
      "totalHeight": 0.31,
      "columnZ": [
        0.14,
        -0.14
      ],
      "centerRail": {
        "startX": 0.173132896932,
        "endX": 0.543444296177,
        "y": 0.0
      }
    },
    "sqrtArgs": {
      "arg1": 0.029975000000000016,
      "arg2": 0.005175000000000006,
      "arg3": 0.013800000000000007,
      "arg4": 0.03272500000000003
    }
  },
  "geometry": {
    "fluidBoundaryPatches": [
      "walls",
      "topAtmosphere",
      "topInflow",
      "tubeOutlet"
    ],
    "fixedGeometryGroups": [
      "container",
      "tube",
      "holders",
      "columns"
    ]
  },
  "meshing": {
    "preset": "coarse"
  },
  "transport": {
    "waterNu": 1e-06,
    "waterRho": 998.2,
    "airNu": 1.5e-05,
    "airRho": 1.2,
    "sigma": 0.072
  },
  "solver": {
    "solver": "interFoam",
    "startTime": 0.0,
    "endTime": 15.0,
    "deltaT": 0.02,
    "writeInterval": 0.1,
    "chunkDuration": 0.5,
    "tubeWallThicknessRatio": 0.2
  },
  "forcing": {
    "mode": "inflow_patch",
    "topPatchFraction": 0.18,
    "inflowVelocity": 0.02,
    "volumetricSourceRate": 0.0,
    "reservoirHead": 0.0
  },
  "eventThresholds": {
    "eps_H": 0.001,
    "eps_dHdt": 0.0001,
    "eps_Q": 1e-06,
    "T_ss": 1.0,
    "dwell": 1.0,
    "requireQBalance": false
  },
  "outputs": {
    "exportRoot": "examples/generated/case-default",
    "manifestPath": null
  },
  "runStatus": {
    "state": "not_started"
  },
  "provenance": {
    "parameterHash": "254df71f13",
    "gitCommit": null,
    "sourceFiles": [
      "experimental_setup.md",
      "setup_3d (2).html"
    ]
  }
}